### ISSUE TITLE
IP150 v4 on mg5050 cannot reconnect after disconnect

### ISSUE THREAD

**Issue by lhubaut** [ParadoxAlarmInterface/pai#87]
## Alarm system
MG 5050 with ip150 v4
IP connection with pai

## Environment
- RPI - docker..
- Python 3.7.2

## Git branch
Master and dev
## Describe the bug
After a couple of hours running, the library disconnect from the panel (probably due to the paradox service) but is never able to reconnect by itself. I have to monitor mqtt events and eventually restart the docker 

## To Reproduce
let it run and wait

## Logs
problem seems to appear at 2019-07-16 22:31:19,990
[paradox.txt](https://github.com/jpbarraca/pai/files/3400582/paradox.txt)

**Comment by lhubaut** [comment]
Hi,
new informations : I had very few disconnection during the past 2 weeks. And I discovered that those disconnection are due to internet issues with my ISP (a couple of minutes). So I have to discuss this issue with my ISP.
But, even when internet is restarting, the library cannot reconnect to my panel and is looping indefinitly (here is the log with a grep): 
`2019-08-05 00:03:49,084 - ERROR    - PAI - Unable to connect to alarm
2019-08-05 00:04:04,183 - ERROR    - PAI - Unable to connect to alarm
2019-08-05 00:04:20,282 - ERROR    - PAI - Unable to connect to alarm
2019-08-05 00:04:41,388 - ERROR    - PAI - Unable to connect to alarm
2019-08-05 00:05:03,490 - ERROR    - PAI - Unable to connect to alarm
2019-08-05 00:05:22,594 - ERROR    - PAI - Unable to connect to alarm
2019-08-05 00:05:42,688 - ERROR    - PAI - Unable to connect to alarm
2019-08-05 00:06:07,797 - ERROR    - PAI - Unable to connect to alarm
2019-08-05 00:06:33,904 - ERROR    - PAI - Unable to connect to alarm
2019-08-05 00:06:57,009 - ERROR    - PAI - Unable to connect to alarm
2019-08-05 00:07:21,103 - ERROR    - PAI - Unable to connect to alarm
2019-08-05 00:07:50,205 - ERROR    - PAI - Unable to connect to alarm
2019-08-05 00:08:20,304 - ERROR    - PAI - Unable to connect to alarm
2019-08-05 00:08:47,403 - ERROR    - PAI - Unable to connect to alarm
2019-08-05 00:09:15,509 - ERROR    - PAI - Unable to connect to alarm
2019-08-05 00:09:33,955 - ERROR    - PAI - Unable to connect to alarm`
So may be a solution is to exit the script and restart it (with docker or a forever)

**Comment by yozik04** [comment]
@jpbarraca Can you decrypt that log and send it to me? Thank you.

**Comment by jpbarraca** [comment]
Cannot decrypt the log until next week. I'm with very limited internet access and no laptop around :)

**Comment by yozik04** [comment]
@lhubaut Then you need to send your log to me. <my nickname>@gmail.com

**Comment by lhubaut** [comment]
ok,
but I will also send you side information that I discovered in private.... seems that the library allow to connect to panel of other people..... seems a serious security lack of paradox

**Comment by lhubaut** [comment]
@yozik04 
Did you get the logs? And understand the strange behaviour?

**Comment by yozik04** [comment]
I saw the logs. Paradox does not care if somebody can log in to your panel remotely. I read somewhere that somebody has already reported this to them already. They did not care.

**Comment by yozik04** [comment]
I have downgraded my IP150 to 1.32 to block all their cloud 💩... I do not trust them.
I see some actionable exceptions in your log. Will try to find time to look into it.

**Comment by yozik04** [comment]
@lhubaut Please try latest dev branch

**Comment by lhubaut** [comment]
Hi,
@yozik04  thanks I will try and let you know.
Do you have a link for downgrading the IP150?
Thanks

**Comment by yozik04** [comment]
=) Try first and send me exceptions you get during session restart. Then I will give you a link 😈. Let's solve it first =)

**Comment by lhubaut** [comment]
Still waiting for a restart (seems my FAI is better thos days)...

**Comment by JacoFourie** [comment]
Hi. I have the same problem. 
 Found Panel MG5050 version 5.33 build 2
 Authentication Success. IP Module version 20, firmware: 4.16

I connect via Site ID. It connects and the with start to gives errors and then will say it lost connection and will not reconnect. If I stop the script and start it again it will run for a while and do the same.

2019-09-13 19:14:49,471 - INFO     - PAI.paradox.hardware.panel - Partition: Area 1, Area 2
2019-09-13 19:15:05,575 - INFO     - PAI.paradox.hardware.panel - User: System Master, Master 1, Master 2, User 04, User 05, User 06, User 07, User 08, User 09, User 10, User 11, User 12, User 13, User 14, User 15, User 16, User 17, User 18, User 19, User 20, User 21, User 22, User 23, User 24, User 25, User 26, User 27, User 28, User 29, User 30, User 31, User 32
2019-09-13 19:15:13,158 - INFO     - PAI.paradox.hardware.panel - Bus-Module: Bus Module 01, Bus Module 02, Bus Module 03, Bus Module 04, Bus Module 05, Bus Module 06, Bus Module 07, Bus Module 08, Bus Module 09, Bus Module 10, Bus Module 11, Bus Module 12, Bus Module 13, Bus Module 14, Bus Module 15
2019-09-13 19:15:14,169 - INFO     - PAI.paradox.hardware.panel - Repeater: Repeater 1, Repeater 2
2019-09-13 19:15:18,231 - INFO     - PAI.paradox.hardware.panel - Keypad: Wireless Keyp 1, Wireless Keyp 2, Wireless Keyp 3, Wireless Keyp 4, Wireless Keyp 5, Wireless Keyp 6, Wireless Keyp 7, Wireless Keyp 8
2019-09-13 19:15:18,732 - INFO     - PAI.paradox.hardware.panel - Site: Your Alarm Site
2019-09-13 19:15:20,230 - INFO     - PAI.paradox.hardware.panel - Siren: Wireless Siren 1, Wireless Siren 2, Wireless Siren 3
2019-09-13 19:15:20,231 - INFO     - PAI.paradox.paradox - Connection OK
Exception in callback Paradox._process_status({'_io': <_io.BytesIO ...at 0x7518d3f0>, '_not_used0': None, '_not_used1': None, 'battery': 13.322352941176472, ...})
handle: <Handle Paradox._process_status({'_io': <_io.BytesIO ...at 0x7518d3f0>, '_not_used0': None, '_not_used1': None, 'battery': 13.322352941176472, ...})>
Traceback (most recent call last):
  File "/usr/local/lib/python3.6/asyncio/events.py", line 145, in _run
    self._callback(*self._args)
  File "/home/pi/pai-dev/paradox/paradox.py", line 233, in _process_status
    self.update_properties(element_type, element_item_key, element_item_status)
  File "/home/pi/pai-dev/paradox/paradox.py", line 567, in update_properties
    elements[type_key][property_name] = property_value  # Initial value, do not notify
  File "/home/pi/pai-dev/paradox/models/element_type_container.py", line 14, in __getitem__
    return self.store[self.__keytransform__(key)]
KeyError: 16
Exception in callback Paradox._process_status({'_io': <_io.BytesIO ...at 0x75062540>, '_not_used0': None, '_not_used1': None, 'battery': 13.411764705882353, ...})
handle: <Handle Paradox._process_status({'_io': <_io.BytesIO ...at 0x75062540>, '_not_used0': None, '_not_used1': None, 'battery': 13.411764705882353, ...})>
Traceback (most recent call last):
  File "/usr/local/lib/python3.6/asyncio/events.py", line 145, in _run
    self._callback(*self._args)
  File "/home/pi/pai-dev/paradox/paradox.py", line 233, in _process_status
    self.update_properties(element_type, element_item_key, element_item_status)
  File "/home/pi/pai-dev/paradox/paradox.py", line 567, in update_properties
    elements[type_key][property_name] = property_value  # Initial value, do not notify
  File "/home/pi/pai-dev/paradox/models/element_type_container.py", line 14, in __getitem__
    return self.store[self.__keytransform__(key)]

**Comment by jpbarraca** [comment]
There are several phases in PAI and a disconnect during the initial enumeration can fail.
After the enumeration is complete, PAI should recover.

**Comment by JacoFourie** [comment]
Hi. Dev does not. It just sits there with no MQTT activity or anything else happening.

This is what I get with the master. It will work fine for a while and then start to go into a loop trying to connect. If I stop it an start it again it will run for a while and do the same again

BabyWare connects and works 100% from my PC so it cant be networking.

```
pi@Inverter:~/pai $ python3.6 run.py
2019-09-13 20:48:03,029 - INFO     - PAI - Starting Paradox Alarm Interface
2019-09-13 20:48:03,031 - INFO     - PAI - Console Log level set to 20
2019-09-13 20:48:03,032 - INFO     - PAI.paradox.interfaces.interface_manager - Using MQTT Interface
2019-09-13 20:48:03,168 - INFO     - PAI.paradox.interfaces.mqtt_interface - MQTT Broker Connected
2019-09-13 20:48:04,151 - INFO     - PAI - Using IP Connection
2019-09-13 20:48:04,985 - INFO     - PAI - Starting...
2019-09-13 20:48:04,987 - INFO     - PAI.paradox.paradox - Disconnecting from the Alarm Panel
2019-09-13 20:48:04,988 - INFO     - PAI.paradox.paradox - Clean Session
2019-09-13 20:48:04,988 - INFO     - PAI.paradox.paradox - Connecting to interface
2019-09-13 20:48:04,989 - INFO     - PAI.paradox.connections.ip_connection - Connecting to Site: xxxxxx
2019-09-13 20:48:04,990 - INFO     - PAI.paradox.connections.ip_connection - Getting site info
2019-09-13 20:48:07,293 - INFO     - PAI.paradox.connections.ip_connection - Connected to Site: xxxxxxx
2019-09-13 20:48:07,295 - INFO     - PAI.paradox.connections.ip_connection - Authenticating with IP Module
2019-09-13 20:48:07,703 - INFO     - PAI.paradox.connections.ip_connection - Authentication Success. IP Module version 20, firmware: 4.16, serial: xxxxxxxx
2019-09-13 20:48:08,883 - INFO     - PAI.paradox.connections.ip_connection - Session Established with IP Module
2019-09-13 20:48:08,883 - INFO     - PAI.paradox.paradox - Connecting to panel
2019-09-13 20:48:08,884 - INFO     - PAI.paradox.paradox - Initiating communication
2019-09-13 20:48:09,405 - INFO     - PAI.paradox.paradox - Found Panel MG5050 version 5.33 build 2
2019-09-13 20:48:09,407 - INFO     - PAI.paradox.paradox - Starting communication
2019-09-13 20:48:09,965 - INFO     - PAI.paradox.hardware.spectra_magellan.panel - Initializing communication
2019-09-13 20:48:10,482 - INFO     - PAI.paradox.hardware.spectra_magellan.panel - Authentication Success
2019-09-13 20:48:10,676 - WARNING  - PAI.paradox.paradox - Missing element ID in system/?, m/m: 48/2, message: Software log on
2019-09-13 20:48:10,997 - INFO     - PAI.paradox.paradox - Panel time synchronized
2019-09-13 20:48:10,998 - INFO     - PAI.paradox.hardware.panel - Updating Labels from Panel
2019-09-13 20:48:11,252 - WARNING  - PAI.paradox.paradox - Missing element ID in system/?, m/m: 45/6, message: Clock loss restore
2019-09-13 20:48:16,280 - ERROR    - PAI.paradox.connections.ip_connection - Connection to panel was lost
2019-09-13 20:48:17,115 - ERROR    - PAI.paradox.paradox - Failed to connect: Failed to write data to connection
2019-09-13 20:48:17,116 - ERROR    - PAI - Unable to connect to alarm
2019-09-13 20:48:20,119 - INFO     - PAI - Starting...
2019-09-13 20:48:20,120 - INFO     - PAI.paradox.paradox - Disconnecting from the Alarm Panel
2019-09-13 20:48:20,122 - INFO     - PAI.paradox.paradox - Clean Session
2019-09-13 20:48:20,124 - INFO     - PAI.paradox.paradox - Connecting to interface
2019-09-13 20:48:20,125 - INFO     - PAI.paradox.connections.ip_connection - Connecting to Site: xxxxxx
2019-09-13 20:48:21,247 - INFO     - PAI.paradox.connections.ip_connection - Connected to Site: xxxxx
2019-09-13 20:48:21,248 - INFO     - PAI.paradox.connections.ip_connection - Authenticating with IP Module
2019-09-13 20:48:21,757 - ERROR    - PAI.paradox.connections.ip_connection - Unable to establish session with IP Module. Timeout. Only one connection at a time is allowed.
2019-09-13 20:48:21,758 - INFO     - PAI.paradox.connections.ip_connection - Connecting to Site: xxxxxxxx
2019-09-13 20:48:22,927 - INFO     - PAI.paradox.connections.ip_connection - Connected to Site: xxxxxxxxx
2019-09-13 20:48:22,928 - INFO     - PAI.paradox.connections.ip_connection - Authenticating with IP Module
2019-09-13 20:48:22,947 - ERROR    - PAI.paradox.connections.ip_connection - Connection to panel was lost
2019-09-13 20:48:23,448 - ERROR    - PAI.paradox.connections.ip_connection - Unable to establish session with IP Module. Timeout. Only one connection at a time is allowed.
2019-09-13 20:48:23,448 - INFO     - PAI.paradox.connections.ip_connection - Connecting to Site: xxxxxxxxx
2019-09-13 20:48:24,646 - INFO     - PAI.paradox.connections.ip_connection - Connected to Site: xxxxxxxxx
2019-09-13 20:48:24,646 - INFO     - PAI.paradox.connections.ip_connection - Authenticating with IP Module
2019-09-13 20:48:24,659 - ERROR    - PAI.paradox.connections.ip_connection - Connection to panel was lost
2019-09-13 20:48:25,043 - INFO     - PAI.paradox.connections.ip_connection - Authentication Success. IP Module version 20, firmware: 4.16, serial: 71066a16
2019-09-13 20:48:26,248 - INFO     - PAI.paradox.connections.ip_connection - Session Established with IP Module
2019-09-13 20:48:26,249 - INFO     - PAI.paradox.paradox - Connecting to panel
2019-09-13 20:48:26,250 - INFO     - PAI.paradox.paradox - Initiating communication
2019-09-13 20:48:26,796 - INFO     - PAI.paradox.paradox - Found Panel MG5050 version 5.33 build 2
2019-09-13 20:48:26,798 - INFO     - PAI.paradox.paradox - Starting communication
2019-09-13 20:48:27,313 - INFO     - PAI.paradox.hardware.spectra_magellan.panel - Initializing communication
2019-09-13 20:48:27,838 - INFO     - PAI.paradox.hardware.spectra_magellan.panel - Authentication Success
2019-09-13 20:48:28,400 - INFO     - PAI.paradox.paradox - Panel time synchronized
2019-09-13 20:48:28,401 - INFO     - PAI.paradox.hardware.panel - Updating Labels from Panel
2019-09-13 20:48:28,573 - WARNING  - PAI.paradox.paradox - Missing element ID in system/?, m/m: 45/6, message: Clock loss restore
2019-09-13 20:48:42,118 - ERROR    - PAI.paradox.hardware.spectra_magellan.panel - ChecksumError wrong checksum, read b'05', computed b'ca', message: b'0001b05a6f6e652032372020202020202020205a6f6e652032382020202020202020208e05'
2019-09-13 20:48:45,691 - INFO     - PAI.paradox.hardware.panel - Zone: DOORS, OFFICE DOOR, GEUST ROOM, DINING DOOR, PANIC, STUDIO, KITCHEN BEAM, DINING BEAM, TV ROOM, OFFICE, BEDROOMS, GARAGE, MAINBED BEAM, LAPA, AMONE ROOM, Zone 16, Zone 17, Zone 18, Zone 19, Zone 20, Zone 21, Zone 22, Zone 23, Zone 24, Zone 25, Zone 26, Zone 27, Zone 28, Zone 29, Zone 30, Zone 31, Zone 32
2019-09-13 20:48:53,755 - INFO     - PAI.paradox.hardware.panel - Pgm: Panic Radio, Burglary Radio, Status LED, Open/Close Radio, Output 05, Output 06, Output 07, Output 08, Output 09, Output 10, Output 11, Output 12, Output 13, Output 14, Output 15, Output 16
2019-09-13 20:48:54,780 - INFO     - PAI.paradox.hardware.panel - Partition: Area 1, Area 2
2019-09-13 20:49:11,078 - INFO     - PAI.paradox.hardware.panel - User: System Master, Master 1, Master 2, User 04, User 05, User 06, User 07, User 08, User 09, User 10, User 11, User 12, User 13, User 14, User 15, User 16, User 17, User 18, User 19, User 20, User 21, User 22, User 23, User 24, User 25, User 26, User 27, User 28, User 29, User 30, User 31, User 32
2019-09-13 20:49:18,737 - INFO     - PAI.paradox.hardware.panel - Bus-Module: Bus Module 01, Bus Module 02, Bus Module 03, Bus Module 04, Bus Module 05, Bus Module 06, Bus Module 07, Bus Module 08, Bus Module 09, Bus Module 10, Bus Module 11, Bus Module 12, Bus Module 13, Bus Module 14, Bus Module 15
2019-09-13 20:49:19,741 - INFO     - PAI.paradox.hardware.panel - Repeater: Repeater 1, Repeater 2
2019-09-13 20:49:23,768 - INFO     - PAI.paradox.hardware.panel - Keypad: Wireless Keyp 1, Wireless Keyp 2, Wireless Keyp 3, Wireless Keyp 4, Wireless Keyp 5, Wireless Keyp 6, Wireless Keyp 7, Wireless Keyp 8
2019-09-13 20:49:24,284 - INFO     - PAI.paradox.hardware.panel - Site: Your Alarm Site
2019-09-13 20:49:25,864 - INFO     - PAI.paradox.hardware.panel - Siren: Wireless Siren 1, Wireless Siren 2, Wireless Siren 3
2019-09-13 20:49:25,866 - INFO     - PAI.paradox.paradox - Connection OK
2019-09-13 20:53:21,821 - ERROR    - PAI.paradox.lib.async_message_manager - No handler for message 5
Detail: Container:
    fields = Container:
        data = b'R\x00\x80\x05\x00\x00\x00\x00\x00\x00\x00\x00\x00\x00\x00\x00'... (truncated, total 36)
        value = Container:
            po = Container:
                command = 5
                status = Container:
                    reserved = False
                    alarm_reporting_pending = False
                    Winload_connected = True
                    NeWare_connected = False
            validation = 128
            address = 5
            data = b'\x00\x00\x00\x00\x00\x00\x00\x00\x00\x00\x00\x00\x00\x00\x00\x00'... (truncated, total 32)
        offset1 = 0
        offset2 = 36
        length = 36
    checksum = b'\xd7' (total 1)
2019-09-13 20:57:16,319 - ERROR    - PAI.paradox.connections.ip_connection - Connection to panel was lost
2019-09-13 20:57:17,044 - ERROR    - PAI - Connection to panel lost: Failed to write data to connection. Restarting
2019-09-13 20:57:17,045 - INFO     - PAI - Starting...
2019-09-13 20:57:17,046 - INFO     - PAI.paradox.paradox - Disconnecting from the Alarm Panel
2019-09-13 20:57:17,047 - INFO     - PAI.paradox.paradox - Clean Session
2019-09-13 20:57:17,047 - INFO     - PAI.paradox.paradox - Connecting to interface
2019-09-13 20:57:17,048 - INFO     - PAI.paradox.connections.ip_connection - Connecting to Site: Fourie Smart House
2019-09-13 20:57:17,793 - ERROR    - PAI.paradox.connections.ip_connection - {'class': b'\x00\x00\x04', 'code': 47, 'reason': b'Connection Timeout or Failure\x00\x00\x00'}
2019-09-13 20:57:17,794 - INFO     - PAI.paradox.connections.ip_connection - Connecting to Site: Fourie Smart House
2019-09-13 20:57:18,540 - ERROR    - PAI.paradox.connections.ip_connection - {'class': b'\x00\x00\x04', 'code': 47, 'reason': b'Connection Timeout or Failure\x00\x00\x00'}
2019-09-13 20:57:18,541 - INFO     - PAI.paradox.connections.ip_connection - Connecting to Site: Fourie Smart House
2019-09-13 20:57:19,284 - ERROR    - PAI.paradox.connections.ip_connection - {'class': b'\x00\x00\x04', 'code': 47, 'reason': b'Connection Timeout or Failure\x00\x00\x00'}
2019-09-13 20:57:19,285 - ERROR    - PAI.paradox.paradox - Failed to connect to interface
2019-09-13 20:57:19,286 - ERROR    - PAI - Unable to connect to alarm
2019-09-13 20:57:19,287 - INFO     - PAI - Starting...
2019-09-13 20:57:19,288 - INFO     - PAI.paradox.paradox - Disconnecting from the Alarm Panel
2019-09-13 20:57:19,289 - INFO     - PAI.paradox.paradox - Clean Session
2019-09-13 20:57:19,290 - INFO     - PAI.paradox.paradox - Connecting to interface
2019-09-13 20:57:19,290 - INFO     - PAI.paradox.connections.ip_connection - Connecting to Site: Fourie Smart House
2019-09-13 20:57:20,037 - ERROR    - PAI.paradox.connections.ip_connection - {'class': b'\x00\x00\x04', 'code': 47, 'reason': b'Connection Timeout or Failure\x00\x00\x00'}
2019-09-13 20:57:20,038 - INFO     - PAI.paradox.connections.ip_connection - Connecting to Site: Fourie Smart House
2019-09-13 20:57:20,782 - ERROR    - PAI.paradox.connections.ip_connection - {'class': b'\x00\x00\x04', 'code': 47, 'reason': b'Connection Timeout or Failure\x00\x00\x00'}
2019-09-13 20:57:20,782 - INFO     - PAI.paradox.connections.ip_connection - Connecting to Site: Fourie Smart House
2019-09-13 20:57:21,526 - ERROR    - PAI.paradox.connections.ip_connection - {'class': b'\x00\x00\x04', 'code': 47, 'reason': b'Connection Timeout or Failure\x00\x00\x00'}
2019-09-13 20:57:21,527 - ERROR    - PAI.paradox.paradox - Failed to connect to interface
2019-09-13 20:57:21,528 - ERROR    - PAI - Unable to connect to alarm
2019-09-13 20:57:22,530 - INFO     - PAI - Starting...
2019-09-13 20:57:22,533 - INFO     - PAI.paradox.paradox - Disconnecting from the Alarm Panel
2019-09-13 20:57:22,534 - INFO     - PAI.paradox.paradox - Clean Session
2019-09-13 20:57:22,535 - INFO     - PAI.paradox.paradox - Connecting to interface
2019-09-13 20:57:22,536 - INFO     - PAI.paradox.connections.ip_connection - Connecting to Site: Fourie Smart House
2019-09-13 20:57:23,279 - ERROR    - PAI.paradox.connections.ip_connection - {'class': b'\x00\x00\x04', 'code': 47, 'reason': b'Connection Timeout or Failure\x00\x00\x00'}
2019-09-13 20:57:23,280 - INFO     - PAI.paradox.connections.ip_connection - Connecting to Site: Fourie Smart House
2019-09-13 20:57:24,016 - ERROR    - PAI.paradox.connections.ip_connection - {'class': b'\x00\x00\x04', 'code': 47, 'reason': b'Connection Timeout or Failure\x00\x00\x00'}
2019-09-13 20:57:24,017 - INFO     - PAI.paradox.connections.ip_connection - Connecting to Site: Fourie Smart House
2019-09-13 20:57:24,756 - ERROR    - PAI.paradox.connections.ip_connection - {'class': b'\x00\x00\x04', 'code': 47, 'reason': b'Connection Timeout or Failure\x00\x00\x00'}
2019-09-13 20:57:24,757 - ERROR    - PAI.paradox.paradox - Failed to connect to interface
2019-09-13 20:57:24,759 - ERROR    - PAI - Unable to connect to alarm
2019-09-13 20:57:30,764 - INFO     - PAI - Starting...
2019-09-13 20:57:30,765 - INFO     - PAI.paradox.paradox - Disconnecting from the Alarm Panel
2019-09-13 20:57:30,765 - INFO     - PAI.paradox.paradox - Clean Session
2019-09-13 20:57:30,765 - INFO     - PAI.paradox.paradox - Connecting to interface
2019-09-13 20:57:30,766 - INFO     - PAI.paradox.connections.ip_connection - Connecting to Site: Fourie Smart House
2019-09-13 20:57:31,509 - ERROR    - PAI.paradox.connections.ip_connection - {'class': b'\x00\x00\x04', 'code': 47, 'reason': b'Connection Timeout or Failure\x00\x00\x00'}
2019-09-13 20:57:31,510 - INFO     - PAI.paradox.connections.ip_connection - Connecting to Site: Fourie Smart House
2019-09-13 20:57:32,256 - ERROR    - PAI.paradox.connections.ip_connection - {'class': b'\x00\x00\x04', 'code': 47, 'reason': b'Connection Timeout or Failure\x00\x00\x00'}
2019-09-13 20:57:32,256 - INFO     - PAI.paradox.connections.ip_connection - Connecting to Site: Fourie Smart House
2019-09-13 20:57:32,998 - ERROR    - PAI.paradox.connections.ip_connection - {'class': b'\x00\x00\x04', 'code': 47, 'reason': b'Connection Timeout or Failure\x00\x00\x00'}
2019-09-13 20:57:32,999 - ERROR    - PAI.paradox.paradox - Failed to connect to interface
2019-09-13 20:57:33,000 - ERROR    - PAI - Unable to connect to alarm
```

**Comment by yozik04** [comment]
"dev" is currently work in progress. So it may not work. Use master. Strange. It connected first time, then failed to load labels...

**Comment by JacoFourie** [comment]
As stated I tried both. Dev just gets stuck and master goes into a reconnection loop. Do you have a protocol doc for the Paradox system? I am also a developer and can have a look te see why it does this.

**Comment by jpbarraca** [comment]
AFAIK there is no public documentation about this process.
I recommend you use wireshark and analyse what is happening.

**Comment by langabi** [comment]
+1 on this for me -- MG5050 panel, IP150 v4. I reset my home internet router, and had exactly the same issue as far as I can see. I can post logs, but they're essentially the same as the above. Thus, issue is not unique to JacoFourie. No further insight, sorry.

**Comment by jpbarraca** [comment]
Can you capture the packets transmitted using wireshark? This may allow us to diagnose the issue.

**Comment by papaiatis** [comment]
Same issue here. After a while the software stops working, disconnects from the panel and never able to recover. If I restart the software it successfully connects again.

```
Sep 18 20:37:10 raspberrypi pai-paradox[8405]: 2019-09-18 20:37:10,148 - INFO     - PAI.paradox.paradox - Clean Session
Sep 18 20:37:10 raspberrypi pai-paradox[8405]: 2019-09-18 20:37:10,148 - INFO     - PAI.paradox.paradox - Connecting to interface
Sep 18 20:37:10 raspberrypi pai-paradox[8405]: 2019-09-18 20:37:10,148 - INFO     - PAI.paradox.connections.ip_connection - Connecting to Site: MyPanel
Sep 18 20:37:10 raspberrypi pai-paradox[8405]: 2019-09-18 20:37:10,403 - ERROR    - PAI.paradox.connections.ip_connection - {'class': b'\x00\x00\x04', 'code': 47, 'reason': b'Connection Timeout or Failure\x00\x00\x00'}
Sep 18 20:37:10 raspberrypi pai-paradox[8405]: 2019-09-18 20:37:10,403 - INFO     - PAI.paradox.connections.ip_connection - Connecting to Site: MyPanel
Sep 18 20:37:10 raspberrypi pai-paradox[8405]: 2019-09-18 20:37:10,648 - ERROR    - PAI.paradox.connections.ip_connection - {'class': b'\x00\x00\x04', 'code': 47, 'reason': b'Connection Timeout or Failure\x00\x00\x00'}
Sep 18 20:37:10 raspberrypi pai-paradox[8405]: 2019-09-18 20:37:10,649 - INFO     - PAI.paradox.connections.ip_connection - Connecting to Site: MyPanel
Sep 18 20:37:10 raspberrypi pai-paradox[8405]: 2019-09-18 20:37:10,892 - ERROR    - PAI.paradox.connections.ip_connection - {'class': b'\x00\x00\x04', 'code': 47, 'reason': b'Connection Timeout or Failure\x00\x00\x00'}
Sep 18 20:37:10 raspberrypi pai-paradox[8405]: 2019-09-18 20:37:10,892 - ERROR    - PAI.paradox.paradox - Failed to connect to interface
Sep 18 20:37:10 raspberrypi pai-paradox[8405]: 2019-09-18 20:37:10,893 - ERROR    - PAI - Unable to connect to alarm
```
After I restart the software, the log shows this:
```
Sep 18 20:43:42 raspberrypi pai-paradox[21829]: 2019-09-18 20:43:42,015 - INFO     - PAI.paradox.paradox - Clean Session
Sep 18 20:43:42 raspberrypi pai-paradox[21829]: 2019-09-18 20:43:42,015 - INFO     - PAI.paradox.paradox - Connecting to interface
Sep 18 20:43:42 raspberrypi pai-paradox[21829]: 2019-09-18 20:43:42,015 - INFO     - PAI.paradox.connections.ip_connection - Connecting to Site: MyPanel
Sep 18 20:43:42 raspberrypi pai-paradox[21829]: 2019-09-18 20:43:42,016 - INFO     - PAI.paradox.connections.ip_connection - Getting site info
Sep 18 20:43:42 raspberrypi pai-paradox[21829]: 2019-09-18 20:43:42,760 - INFO     - PAI.paradox.connections.ip_connection - Connected to Site: MyPanel
Sep 18 20:43:42 raspberrypi pai-paradox[21829]: 2019-09-18 20:43:42,761 - INFO     - PAI.paradox.connections.ip_connection - Authenticating with IP Module
Sep 18 20:43:43 raspberrypi pai-paradox[21829]: 2019-09-18 20:43:43,293 - INFO     - PAI.paradox.connections.ip_connection - Authentication Success. IP Module version 20, firmware: 4.64, serial: 71070b37
Sep 18 20:43:43 raspberrypi pai-paradox[21829]: 2019-09-18 20:43:43,776 - INFO     - PAI.paradox.connections.ip_connection - Session Established with IP Module
```

**Comment by jpbarraca** [comment]
Can you provide a packet capture made with wireshark? https://www.wireshark.org/

**Comment by papaiatis** [comment]
I can. Any suggestion on capture filters? I have tshark installed, no wireshark available (no GUI).

**Comment by papaiatis** [comment]
I believe this is the main part below. Captured all traffic on the host.
```
 1050 27.898961894 192.168.1.99 → 192.168.1.1  DNS 84 Standard query 0xc995 A turn.paradoxmyhome.com
 1051 27.899985278  192.168.1.1 → 192.168.1.99 DNS 100 Standard query response 0xc995 A turn.paradoxmyhome.com A 35.156.86.205
 1052 27.900351163 192.168.1.99 → 35.156.86.205 TCP 76 45981 → 3478 [SYN] Seq=0 Win=29200 Len=0 MSS=1460 SACK_PERM=1 TSval=1839355838 TSecr=0 WS=128
 1053 27.946375895 35.156.86.205 → 192.168.1.99 TCP 76 3478 → 45981 [SYN, ACK] Seq=0 Ack=1 Win=26847 Len=0 MSS=1452 SACK_PERM=1 TSval=3477397044 TSecr=1839355838 WS=512
 1054 27.946575166 192.168.1.99 → 35.156.86.205 TCP 68 45981 → 3478 [ACK] Seq=1 Ack=1 Win=29312 Len=0 TSval=1839355884 TSecr=3477397044
 1055 27.947249436 192.168.1.99 → 35.156.86.205 TCP 68 40399 → 3478 [FIN, ACK] Seq=1 Ack=1 Win=229 Len=0 TSval=1839355885 TSecr=3477389524
 1056 27.947482925 192.168.1.99 → 35.156.86.205 STUN 112 Allocate Request TCP lifetime: 600
 1057 27.990329588 35.156.86.205 → 192.168.1.99 TCP 68 3478 → 45981 [ACK] Seq=1 Ack=45 Win=27136 Len=0 TSval=3477397056 TSecr=1839355885
 1058 27.990494223 35.156.86.205 → 192.168.1.99 STUN 164 Allocate Success Response XOR-RELAYED-ADDRESS: 35.156.86.205:42843 XOR-MAPPED-ADDRESS: 78.92.10.208:45981 lifetime: 600
 1059 27.990553807 192.168.1.99 → 35.156.86.205 TCP 68 45981 → 3478 [ACK] Seq=45 Ack=97 Win=29312 Len=0 TSval=1839355928 TSecr=3477397056
 1060 27.991308545 192.168.1.99 → 35.156.86.205 STUN 88 Binding Request
 1061 28.003013218 35.156.86.205 → 192.168.1.99 TCP 68 3478 → 40399 [RST, ACK] Seq=1 Ack=2 Win=53 Len=0 TSval=3477397059 TSecr=1839355885
 1062 28.033546876 35.156.86.205 → 192.168.1.99 STUN 160 Binding Success Response XOR-MAPPED-ADDRESS: 78.92.10.208:45981 MAPPED-ADDRESS: 78.92.10.208:45981 RESPONSE-ORIGIN: 10.2.43.12:3478
 1063 28.034312292 192.168.1.99 → 35.156.86.205 STUN 100 Connect Request XOR-PEER-ADDRESS: 18.184.231.237:25801
 1065 28.077850830 35.156.86.205 → 192.168.1.99 STUN 128 Connect Error Response error-code: 447 (Connection Timeout or Failure) Connection Timeout or Failure
 1066 28.081376346 192.168.1.99 → 192.168.1.1  DNS 84 Standard query 0x5cdc A turn.paradoxmyhome.com
 1067 28.082401032  192.168.1.1 → 192.168.1.99 DNS 100 Standard query response 0x5cdc A turn.paradoxmyhome.com A 35.156.86.205
 1068 28.083595666 192.168.1.99 → 35.156.86.205 TCP 76 45605 → 3478 [SYN] Seq=0 Win=29200 Len=0 MSS=1460 SACK_PERM=1 TSval=1839356021 TSecr=0 WS=128
 1070 28.125170456 192.168.1.99 → 35.156.86.205 TCP 68 45981 → 3478 [ACK] Seq=97 Ack=249 Win=29312 Len=0 TSval=1839356063 TSecr=3477397078
 1071 28.138089293 35.156.86.205 → 192.168.1.99 TCP 76 3478 → 45605 [SYN, ACK] Seq=0 Ack=1 Win=26847 Len=0 MSS=1452 SACK_PERM=1 TSval=3477397093 TSecr=1839356021 WS=512
 1072 28.138197470 192.168.1.99 → 35.156.86.205 TCP 68 45605 → 3478 [ACK] Seq=1 Ack=1 Win=29312 Len=0 TSval=1839356076 TSecr=3477397093
 1073 28.138817730 192.168.1.99 → 35.156.86.205 TCP 68 45981 → 3478 [FIN, ACK] Seq=97 Ack=249 Win=29312 Len=0 TSval=1839356077 TSecr=3477397078
 1074 28.139056323 192.168.1.99 → 35.156.86.205 STUN 112 Allocate Request TCP lifetime: 600
 1075 28.186515898 35.156.86.205 → 192.168.1.99 TCP 68 3478 → 45981 [RST, ACK] Seq=249 Ack=98 Win=27136 Len=0 TSval=3477397104 TSecr=1839356077
 1076 28.192998754 35.156.86.205 → 192.168.1.99 TCP 68 3478 → 45605 [ACK] Seq=1 Ack=45 Win=27136 Len=0 TSval=3477397107 TSecr=1839356077
 1077 28.193228493 35.156.86.205 → 192.168.1.99 STUN 164 Allocate Success Response XOR-RELAYED-ADDRESS: 35.156.86.205:57709 XOR-MAPPED-ADDRESS: 78.92.10.208:45605 lifetime: 600
 1078 28.193289379 192.168.1.99 → 35.156.86.205 TCP 68 45605 → 3478 [ACK] Seq=45 Ack=97 Win=29312 Len=0 TSval=1839356131 TSecr=3477397107
 1079 28.194100732 192.168.1.99 → 35.156.86.205 STUN 88 Binding Request
 1090 28.247506444 35.156.86.205 → 192.168.1.99 STUN 160 Binding Success Response XOR-MAPPED-ADDRESS: 78.92.10.208:45605 MAPPED-ADDRESS: 78.92.10.208:45605 RESPONSE-ORIGIN: 10.2.43.12:3478
 1091 28.248311443 192.168.1.99 → 35.156.86.205 STUN 100 Connect Request XOR-PEER-ADDRESS: 18.184.231.237:25801
 1092 28.306402358 35.156.86.205 → 192.168.1.99 STUN 128 Connect Error Response error-code: 447 (Connection Timeout or Failure) Connection Timeout or Failure
 1093 28.309756520 192.168.1.99 → 192.168.1.1  DNS 84 Standard query 0x8058 A turn.paradoxmyhome.com
 1094 28.310800164  192.168.1.1 → 192.168.1.99 DNS 100 Standard query response 0x8058 A turn.paradoxmyhome.com A 35.156.86.205
 1095 28.312351100 192.168.1.99 → 35.156.86.205 TCP 76 37869 → 3478 [SYN] Seq=0 Win=29200 Len=0 MSS=1460 SACK_PERM=1 TSval=1839356250 TSecr=0 WS=128
 1096 28.355182972 192.168.1.99 → 35.156.86.205 TCP 68 45605 → 3478 [ACK] Seq=97 Ack=249 Win=29312 Len=0 TSval=1839356293 TSecr=3477397134
 1097 28.356810626 35.156.86.205 → 192.168.1.99 TCP 76 3478 → 37869 [SYN, ACK] Seq=0 Ack=1 Win=26847 Len=0 MSS=1452 SACK_PERM=1 TSval=3477397148 TSecr=1839356250 WS=512
 1098 28.356954376 192.168.1.99 → 35.156.86.205 TCP 68 37869 → 3478 [ACK] Seq=1 Ack=1 Win=29312 Len=0 TSval=1839356295 TSecr=3477397148
 1099 28.357583073 192.168.1.99 → 35.156.86.205 TCP 68 45605 → 3478 [FIN, ACK] Seq=97 Ack=249 Win=29312 Len=0 TSval=1839356295 TSecr=3477397134
 1100 28.357823385 192.168.1.99 → 35.156.86.205 STUN 112 Allocate Request TCP lifetime: 600
 1101 28.403405045 35.156.86.205 → 192.168.1.99 TCP 68 3478 → 37869 [ACK] Seq=1 Ack=45 Win=27136 Len=0 TSval=3477397159 TSecr=1839356296
 1102 28.403540461 35.156.86.205 → 192.168.1.99 STUN 164 Allocate Success Response XOR-RELAYED-ADDRESS: 35.156.86.205:34063 XOR-MAPPED-ADDRESS: 78.92.10.208:37869 lifetime: 600
 1103 28.403597805 192.168.1.99 → 35.156.86.205 TCP 68 37869 → 3478 [ACK] Seq=45 Ack=97 Win=29312 Len=0 TSval=1839356341 TSecr=3477397159
 1104 28.404350565 192.168.1.99 → 35.156.86.205 STUN 88 Binding Request
 1105 28.411341441 35.156.86.205 → 192.168.1.99 TCP 68 3478 → 45605 [RST, ACK] Seq=249 Ack=98 Win=27136 Len=0 TSval=3477397161 TSecr=1839356295
 1106 28.449533631 35.156.86.205 → 192.168.1.99 STUN 160 Binding Success Response XOR-MAPPED-ADDRESS: 78.92.10.208:37869 MAPPED-ADDRESS: 78.92.10.208:37869 RESPONSE-ORIGIN: 10.2.43.12:3478
 1107 28.450121131 192.168.1.99 → 35.156.86.205 STUN 100 Connect Request XOR-PEER-ADDRESS: 18.184.231.237:25801
 1108 28.495619666 35.156.86.205 → 192.168.1.99 STUN 128 Connect Error Response error-code: 447 (Connection Timeout or Failure) Connection Timeout or Failure
 1109 28.545200279 192.168.1.99 → 35.156.86.205 TCP 68 37869 → 3478 [ACK] Seq=97 Ack=249 Win=29312 Len=0 TSval=1839356483 TSecr=3477397182
```
Guess what happened after this.
I executed another packet capture but this time I tried to use the command `tshark -ni any "host 35.156.86.205"`, to get rid of the garbage. I did not get any output but the software somehow recovered and was able to connect to the module! And this was the log for this event:
```
Sep 26 13:54:05 raspberrypi pai-paradox[17522]: 2019-09-26 13:54:05,292 - INFO     - PAI - Starting...
Sep 26 13:54:05 raspberrypi pai-paradox[17522]: 2019-09-26 13:54:05,293 - INFO     - PAI.paradox.paradox - Disconnecting from the Alarm Panel
Sep 26 13:54:05 raspberrypi pai-paradox[17522]: 2019-09-26 13:54:05,294 - INFO     - PAI.paradox.paradox - Clean Session
Sep 26 13:54:05 raspberrypi pai-paradox[17522]: 2019-09-26 13:54:05,294 - INFO     - PAI.paradox.paradox - Connecting to interface
Sep 26 13:54:05 raspberrypi pai-paradox[17522]: 2019-09-26 13:54:05,295 - INFO     - PAI.paradox.connections.ip_connection - Connecting to Site: MyPanel
Sep 26 13:54:05 raspberrypi pai-paradox[17522]: 2019-09-26 13:54:05,621 - INFO     - PAI.paradox.connections.ip_connection - Connected to Site: MyPanel
Sep 26 13:54:05 raspberrypi pai-paradox[17522]: 2019-09-26 13:54:05,622 - INFO     - PAI.paradox.connections.ip_connection - Authenticating with IP Module
Sep 26 13:54:05 raspberrypi pai-paradox[17522]: 2019-09-26 13:54:05,740 - INFO     - PAI.paradox.connections.ip_connection - Authentication Success. IP Module version 20, firmware: 4.48, serial: 71084edb
Sep 26 13:54:06 raspberrypi pai-paradox[17522]: 2019-09-26 13:54:06,009 - INFO     - PAI.paradox.connections.ip_connection - Session Established with IP Module
Sep 26 13:54:06 raspberrypi pai-paradox[17522]: 2019-09-26 13:54:06,009 - INFO     - PAI.paradox.paradox - Connecting to panel
Sep 26 13:54:06 raspberrypi pai-paradox[17522]: 2019-09-26 13:54:06,010 - INFO     - PAI.paradox.paradox - Initiating communication
Sep 26 13:54:06 raspberrypi pai-paradox[17522]: 2019-09-26 13:54:06,205 - INFO     - PAI.paradox.paradox - Found Panel SP6000 version 6.144 build 10
Sep 26 13:54:06 raspberrypi pai-paradox[17522]: 2019-09-26 13:54:06,206 - INFO     - PAI.paradox.paradox - Starting communication
Sep 26 13:54:06 raspberrypi pai-paradox[17522]: 2019-09-26 13:54:06,395 - INFO     - PAI.paradox.hardware.spectra_magellan.panel - Initializing communication
Sep 26 13:54:06 raspberrypi pai-paradox[17522]: 2019-09-26 13:54:06,628 - INFO     - PAI.paradox.hardware.spectra_magellan.panel - Authentication Success
Sep 26 13:54:06 raspberrypi pai-paradox[17522]: Task exception was never retrieved
Sep 26 13:54:06 raspberrypi pai-paradox[17522]: future: <Task finished coro=<Paradox.receive_worker() done, defined at /opt/pai/paradox/paradox.py:251> exception=AttributeError("'NoneType' object has no attribute 'read_message'")>
Sep 26 13:54:06 raspberrypi pai-paradox[17522]: Traceback (most recent call last):
Sep 26 13:54:06 raspberrypi pai-paradox[17522]:   File "/opt/pai/paradox/paradox.py", line 257, in receive_worker
Sep 26 13:54:06 raspberrypi pai-paradox[17522]:     await self.receive()
Sep 26 13:54:06 raspberrypi pai-paradox[17522]:   File "/opt/pai/paradox/paradox.py", line 273, in receive
Sep 26 13:54:06 raspberrypi pai-paradox[17522]:     data = await data
Sep 26 13:54:06 raspberrypi pai-paradox[17522]:   File "/opt/pai/paradox/connections/ip_connection.py", line 324, in read
Sep 26 13:54:06 raspberrypi pai-paradox[17522]:     result = await self.connection.read_message(timeout=timeout)
Sep 26 13:54:06 raspberrypi pai-paradox[17522]: AttributeError: 'NoneType' object has no attribute 'read_message'
Sep 26 13:54:06 raspberrypi pai-paradox[17522]: 2019-09-26 13:54:06,766 - WARNING  - PAI.paradox.paradox - Missing element ID in system/?, m/m: 48/2, message: Software log on
Sep 26 13:54:06 raspberrypi pai-paradox[17522]: 2019-09-26 13:54:06,884 - INFO     - PAI.paradox.paradox - Panel time synchronized
Sep 26 13:54:06 raspberrypi pai-paradox[17522]: 2019-09-26 13:54:06,885 - INFO     - PAI.paradox.hardware.panel - Updating Labels from Panel
```
I'm not sure how or why tshark influenced in the communication between the software and turn.paradoxmyhome.com

**Comment by jpbarraca** [comment]
Try the latest dev branch as it is substantially different from the main.

**Comment by jpbarraca** [comment]
Now the IP Connection fully disconnects after the panel stops responding to status updates. It must be tested as I do not have an IP150 panel.

**Comment by papaiatis** [comment]
Let me test it.

**Comment by papaiatis** [comment]
Software stuck after 2 days and unfortunately the logs got rotated too so I have no idea what was the last log lines. 
I set up logging to file now, so next time I'll have more information.

**Comment by jpbarraca** [comment]
Great. I'm doing the same test.

**Comment by yozik04** [comment]
I have committed some more fixes to `dev`. Please try.

**Comment by papaiatis** [comment]
Software stuck again 2 days ago, and these are the last log lines:
```
2019-09-30 14:50:19,425 - INFO     - PAI.paradox.connections.ip_connection - Connecting to Site: MyPanel
2019-09-30 14:50:19,627 - ERROR    - PAI.paradox.connections.ip_connection - {'class': b'\x00\x00\x04', 'code': 47, 'reason': b'Connection Timeout or Failure\x00\x00\x00'}
2019-09-30 14:50:19,628 - INFO     - PAI.paradox.connections.ip_connection - Connecting to Site: MyPanel
2019-09-30 14:50:19,843 - ERROR    - PAI.paradox.connections.ip_connection - {'class': b'\x00\x00\x04', 'code': 47, 'reason': b'Connection Timeout or Failure\x00\x00\x00'}
2019-09-30 14:50:19,845 - INFO     - PAI.paradox.connections.ip_connection - Connecting to Site: MyPanel
2019-09-30 14:50:20,042 - ERROR    - PAI.paradox.connections.ip_connection - {'class': b'\x00\x00\x04', 'code': 47, 'reason': b'Connection Timeout or Failure\x00\x00\x00'}
2019-09-30 14:50:20,043 - ERROR    - PAI.paradox.paradox - Failed to connect to interface
2019-09-30 14:50:20,045 - ERROR    - PAI - Unable to connect to alarm
2019-09-30 14:50:24,050 - INFO     - PAI - Starting...
```
Now I'm doing `git pull` and will check the latest fixes by @yozik04

**Comment by papaiatis** [comment]
@yozik04 
Ups, there's an exception that wasn't here before:

```
2019-10-02 21:51:29,628 - ERROR    - PAI.paradox.paradox - Loop
Traceback (most recent call last):
  File "/opt/pai/paradox/paradox.py", line 194, in async_loop
    result = await asyncio.gather(*[self._status_request(i) for i in cfg.STATUS_REQUESTS])
  File "/opt/pai/paradox/paradox.py", line 227, in _status_request
    return self.panel.handle_status(reply)
  File "/opt/pai/paradox/hardware/spectra_magellan/panel.py", line 165, in handle_status
    if time.time() - self.core.last_power_update >= cfg.POWER_UPDATE_INTERVAL:
AttributeError: 'Paradox' object has no attribute 'last_power_update'

```

**Comment by yozik04** [comment]
Checking.

**Comment by yozik04** [comment]
Should be fixed.

**Comment by papaiatis** [comment]
@yozik04 awesomely quick fix! 
So far so good now. Last log says `Connection OK`. Let's wait.

**Comment by jpbarraca** [comment]
It would be great if you could leave a tcpdump with a ring-buffer. The issue may be at the network level

**Comment by yozik04** [comment]
It should detect disconnection and reconnect. I fixed some stuff there.

**Comment by britsmarius** [comment]
> 
> 
> Hi,
> @yozik04 thanks I will try and let you know.
> Do you have a link for downgrading the IP150?
> Thanks



> 
> 
> I have downgraded my IP150 to 1.32 to block all their cloud 💩... I do not trust them.
> I see some actionable exceptions in your log. Will try to find time to look into it.

Hi Yozik04

Please share how to downgrade to 1.32 my home automation has stopped working with the Paradox alarm because they upgraded the IP150 moving to Insight, I no longer want to be part of this cloud solution and want my system working again. I have tried PAI but with no luck and I believe it is due to MG5050 still running 4.92.

Please help to downgrade

**Comment by yozik04** [comment]
Downgrade process is described here:
https://github.com/Tertiush/ParadoxIP150v2/issues/22

**Comment by jpbarraca** [comment]
As an alternative you can also connect directly through the serial port, bypassing the IP150

**Comment by britsmarius** [comment]
thank you one problem

were can I find this file IP150_V1_32_001_ENG_downgrade_from_v4.xx.PuF

**Comment by yozik04** [comment]
It is there in the same thread.

**Comment by yozik04** [comment]
Did you tried to login with BabyWare with local IP? In latest IP150 there seems that this option is enabled again. No?

**Comment by britsmarius** [comment]
Are you revering to the swan on or off option I see my IP 150 is now on
Firmware version 4.42.02

**Comment by yozik04** [comment]
if you have an option to turn off swan, turn it off and try with babyware using IP/Static

**Comment by britsmarius** [comment]
When I log in to IP150 there Is no option to turn off swan

**Comment by yozik04** [comment]
Yes, according to changelog they have removed the option in 4.40.011

**Comment by yozik04** [comment]
But still try Babyware.

**Comment by britsmarius** [comment]
So I will need to downgrade yes ?

**Comment by yozik04** [comment]
Try first. Then if it won't connect you can try to downgrade. But if it will work let us know...

**Comment by britsmarius** [comment]
Maybe I am not clear what would you like me to do with babyware

**Comment by yozik04** [comment]
Can you PM me in gitter?

**Comment by britsmarius** [comment]
sent you a message

**Comment by rogercrespo** [comment]
Hello, in firmware 4.42 there is no option to disable swan. 

I'm trying to downgrade with no success. I'm following the other thread but I got stucked in transfer process and the IP150 communication fails then recover. Need help please...

**Comment by yozik04** [comment]
Let's not hijack the thread. Let's focus on reconnection problems here.

**Comment by papaiatis** [comment]
After ran a couple of days I'm seeing errors and exceptions again:

```
Oct 10 17:12:37 raspberrypi pai-paradox[5061]: 2019-10-10 17:12:37,544 - INFO     - PAI - Starting...
Oct 10 17:12:37 raspberrypi pai-paradox[5061]: 2019-10-10 17:12:37,546 - INFO     - PAI.paradox.paradox - Disconnecting from the Alarm Panel
Oct 10 17:12:37 raspberrypi pai-paradox[5061]: 2019-10-10 17:12:37,547 - INFO     - PAI.paradox.paradox - Clean Session
Oct 10 17:12:37 raspberrypi pai-paradox[5061]: 2019-10-10 17:12:37,547 - INFO     - PAI.paradox.paradox - Connecting to interface
Oct 10 17:12:37 raspberrypi pai-paradox[5061]: 2019-10-10 17:12:37,549 - INFO     - PAI.paradox.connections.ip_connection - Connecting to Site: MyPanel
Oct 10 17:12:37 raspberrypi pai-paradox[5061]: 2019-10-10 17:12:37,904 - INFO     - PAI.paradox.connections.ip_connection - Connected to Site: MyPanel
Oct 10 17:12:37 raspberrypi pai-paradox[5061]: 2019-10-10 17:12:37,904 - INFO     - PAI.paradox.connections.ip_connection - Authenticating with IP Module
Oct 10 17:12:38 raspberrypi pai-paradox[5061]: 2019-10-10 17:12:38,413 - INFO     - PAI.paradox.connections.ip_connection - Authentication Success. IP Module version 20, firmware: 4.30, serial: 7107b94a
Oct 10 17:12:38 raspberrypi pai-paradox[5061]: 2019-10-10 17:12:38,758 - INFO     - PAI.paradox.connections.ip_connection - Session Established with IP Module
Oct 10 17:12:38 raspberrypi pai-paradox[5061]: 2019-10-10 17:12:38,759 - INFO     - PAI.paradox.paradox - Connecting to panel
Oct 10 17:12:38 raspberrypi pai-paradox[5061]: 2019-10-10 17:12:38,760 - INFO     - PAI.paradox.paradox - Initiating communication
Oct 10 17:12:38 raspberrypi pai-paradox[5061]: 2019-10-10 17:12:38,993 - INFO     - PAI.paradox.paradox - Found Panel MG5000 version 4.86 build 6
Oct 10 17:12:38 raspberrypi pai-paradox[5061]: 2019-10-10 17:12:38,994 - INFO     - PAI.paradox.paradox - Starting communication
Oct 10 17:12:39 raspberrypi pai-paradox[5061]: 2019-10-10 17:12:39,211 - INFO     - PAI.paradox.hardware.spectra_magellan.panel - Initializing communication
Oct 10 17:12:39 raspberrypi pai-paradox[5061]: 2019-10-10 17:12:39,453 - INFO     - PAI.paradox.hardware.spectra_magellan.panel - Authentication Success
Oct 10 17:12:39 raspberrypi pai-paradox[5061]: Task exception was never retrieved
Oct 10 17:12:39 raspberrypi pai-paradox[5061]: future: <Task finished coro=<Paradox.receive_worker() done, defined at /opt/pai/paradox/paradox.py:250> exception=ConnectionError('Unable to read data. Connection transport not connected')>
Oct 10 17:12:39 raspberrypi pai-paradox[5061]: Traceback (most recent call last):
Oct 10 17:12:39 raspberrypi pai-paradox[5061]:   File "/opt/pai/paradox/paradox.py", line 256, in receive_worker
Oct 10 17:12:39 raspberrypi pai-paradox[5061]:     await self.receive()
Oct 10 17:12:39 raspberrypi pai-paradox[5061]:   File "/opt/pai/paradox/paradox.py", line 270, in receive
Oct 10 17:12:39 raspberrypi pai-paradox[5061]:     data = await data
Oct 10 17:12:39 raspberrypi pai-paradox[5061]:   File "/opt/pai/paradox/connections/ip_connection.py", line 344, in read
Oct 10 17:12:39 raspberrypi pai-paradox[5061]:     result = await super().read(timeout)
Oct 10 17:12:39 raspberrypi pai-paradox[5061]:   File "/opt/pai/paradox/connections/connection.py", line 57, in read
Oct 10 17:12:39 raspberrypi pai-paradox[5061]:     raise ConnectionError("Unable to read data. Connection transport not connected")
Oct 10 17:12:39 raspberrypi pai-paradox[5061]: ConnectionError: Unable to read data. Connection transport not connected
Oct 10 17:12:39 raspberrypi pai-paradox[5061]: 2019-10-10 17:12:39,607 - WARNING  - PAI.paradox.paradox - Missing element ID in system/?, m/m: 48/2, message: Software log on
Oct 10 17:12:39 raspberrypi pai-paradox[5061]: 2019-10-10 17:12:39,721 - INFO     - PAI.paradox.paradox - Panel time synchronized
Oct 10 17:12:39 raspberrypi pai-paradox[5061]: 2019-10-10 17:12:39,722 - INFO     - PAI.paradox.hardware.panel - Updating Labels from Panel
Oct 10 17:12:39 raspberrypi pai-paradox[5061]: 2019-10-10 17:12:39,885 - WARNING  - PAI.paradox.paradox - Missing element ID in system/?, m/m: 45/6, message: Clock loss restore
Oct 10 17:12:44 raspberrypi pai-paradox[5061]: 2019-10-10 17:12:44,931 - ERROR    - PAI.paradox.lib.async_message_manager - No handler for message 5
Oct 10 17:12:44 raspberrypi pai-paradox[5061]: Detail: Container:
Oct 10 17:12:44 raspberrypi pai-paradox[5061]:     fields = Container:
Oct 10 17:12:44 raspberrypi pai-paradox[5061]:         data = b'R\x00\x000Zone 03     '... (truncated, total 36)
Oct 10 17:12:44 raspberrypi pai-paradox[5061]:         value = Container:
Oct 10 17:12:44 raspberrypi pai-paradox[5061]:             po = Container:
Oct 10 17:12:44 raspberrypi pai-paradox[5061]:                 command = 5
Oct 10 17:12:44 raspberrypi pai-paradox[5061]:                 status = Container:
Oct 10 17:12:44 raspberrypi pai-paradox[5061]:                     reserved = False
Oct 10 17:12:44 raspberrypi pai-paradox[5061]:                     alarm_reporting_pending = False
Oct 10 17:12:44 raspberrypi pai-paradox[5061]:                     Winload_connected = True
Oct 10 17:12:44 raspberrypi pai-paradox[5061]:                     NeWare_connected = False
Oct 10 17:12:44 raspberrypi pai-paradox[5061]:             address = 48
Oct 10 17:12:44 raspberrypi pai-paradox[5061]:             data = b'Zone 03         '... (truncated, total 32)
Oct 10 17:12:44 raspberrypi pai-paradox[5061]:         offset1 = 0
Oct 10 17:12:44 raspberrypi pai-paradox[5061]:         offset2 = 36
Oct 10 17:12:44 raspberrypi pai-paradox[5061]:         length = 36
Oct 10 17:12:44 raspberrypi pai-paradox[5061]:     checksum = b'\x01' (total 1)
```
Then Connection Timeout for many times:
```
Oct 10 17:27:22 raspberrypi pai-paradox[5061]: 2019-10-10 17:27:22,402 - INFO     - PAI - Starting...
Oct 10 17:27:22 raspberrypi pai-paradox[5061]: 2019-10-10 17:27:22,405 - INFO     - PAI.paradox.paradox - Disconnecting from the Alarm Panel
Oct 10 17:27:22 raspberrypi pai-paradox[5061]: 2019-10-10 17:27:22,406 - INFO     - PAI.paradox.paradox - Clean Session
Oct 10 17:27:22 raspberrypi pai-paradox[5061]: 2019-10-10 17:27:22,406 - INFO     - PAI.paradox.paradox - Connecting to interface
Oct 10 17:27:22 raspberrypi pai-paradox[5061]: 2019-10-10 17:27:22,407 - INFO     - PAI.paradox.connections.ip_connection - Connecting to Site: MyPanel
Oct 10 17:27:22 raspberrypi pai-paradox[5061]: 2019-10-10 17:27:22,649 - ERROR    - PAI.paradox.connections.ip_connection - {'class': b'\x00\x00\x04', 'code': 47, 'reason': b'Connection Timeout or Failure\x00\x00\x00'}
Oct 10 17:27:22 raspberrypi pai-paradox[5061]: 2019-10-10 17:27:22,649 - INFO     - PAI.paradox.connections.ip_connection - Connecting to Site: MyPanel
Oct 10 17:27:22 raspberrypi pai-paradox[5061]: 2019-10-10 17:27:22,845 - ERROR    - PAI.paradox.connections.ip_connection - {'class': b'\x00\x00\x04', 'code': 47, 'reason': b'Connection Timeout or Failure\x00\x00\x00'}
Oct 10 17:27:22 raspberrypi pai-paradox[5061]: 2019-10-10 17:27:22,846 - INFO     - PAI.paradox.connections.ip_connection - Connecting to Site: MyPanel
Oct 10 17:27:23 raspberrypi pai-paradox[5061]: 2019-10-10 17:27:23,046 - ERROR    - PAI.paradox.connections.ip_connection - {'class': b'\x00\x00\x04', 'code': 47, 'reason': b'Connection Timeout or Failure\x00\x00\x00'}
Oct 10 17:27:23 raspberrypi pai-paradox[5061]: 2019-10-10 17:27:23,048 - ERROR    - PAI.paradox.paradox - Failed to connect to interface
Oct 10 17:27:23 raspberrypi pai-paradox[5061]: 2019-10-10 17:27:23,049 - ERROR    - PAI - Unable to connect to alarm
```
After about an hour it was able to authenticate but got a different error:
```
Oct 10 18:16:28 raspberrypi pai-paradox[5061]: 2019-10-10 18:16:28,871 - INFO     - PAI - Starting...
Oct 10 18:16:28 raspberrypi pai-paradox[5061]: 2019-10-10 18:16:28,873 - INFO     - PAI.paradox.paradox - Disconnecting from the Alarm Panel
Oct 10 18:16:28 raspberrypi pai-paradox[5061]: 2019-10-10 18:16:28,874 - INFO     - PAI.paradox.paradox - Clean Session
Oct 10 18:16:28 raspberrypi pai-paradox[5061]: 2019-10-10 18:16:28,874 - INFO     - PAI.paradox.paradox - Connecting to interface
Oct 10 18:16:28 raspberrypi pai-paradox[5061]: 2019-10-10 18:16:28,875 - INFO     - PAI.paradox.connections.ip_connection - Connecting to Site: MyPanel
Oct 10 18:16:29 raspberrypi pai-paradox[5061]: 2019-10-10 18:16:29,223 - INFO     - PAI.paradox.connections.ip_connection - Connected to Site: MyPanel
Oct 10 18:16:29 raspberrypi pai-paradox[5061]: 2019-10-10 18:16:29,223 - INFO     - PAI.paradox.connections.ip_connection - Authenticating with IP Module
Oct 10 18:16:29 raspberrypi pai-paradox[5061]: 2019-10-10 18:16:29,328 - INFO     - PAI.paradox.connections.ip_connection - Authentication Success. IP Module version 20, firmware: 4.42, serial: 7103deae
Oct 10 18:16:29 raspberrypi pai-paradox[5061]: 2019-10-10 18:16:29,633 - INFO     - PAI.paradox.connections.ip_connection - Session Established with IP Module
Oct 10 18:16:29 raspberrypi pai-paradox[5061]: 2019-10-10 18:16:29,634 - INFO     - PAI.paradox.paradox - Connecting to panel
Oct 10 18:16:29 raspberrypi pai-paradox[5061]: 2019-10-10 18:16:29,636 - INFO     - PAI.paradox.paradox - Initiating communication
Oct 10 18:16:29 raspberrypi pai-paradox[5061]: 2019-10-10 18:16:29,861 - INFO     - PAI.paradox.paradox - Found Panel MG5050 version 4.76 build 0
Oct 10 18:16:29 raspberrypi pai-paradox[5061]: 2019-10-10 18:16:29,864 - INFO     - PAI.paradox.paradox - Starting communication
Oct 10 18:16:30 raspberrypi pai-paradox[5061]: 2019-10-10 18:16:30,081 - INFO     - PAI.paradox.hardware.spectra_magellan.panel - Initializing communication
Oct 10 18:16:30 raspberrypi pai-paradox[5061]: 2019-10-10 18:16:30,291 - ERROR    - PAI.paradox.paradox - Got ERROR Message: Invalid PC Password
Oct 10 18:16:31 raspberrypi pai-paradox[5061]: 2019-10-10 18:16:31,303 - ERROR    - PAI.paradox.paradox - Got ERROR Message: Invalid PC Password
Oct 10 18:16:32 raspberrypi pai-paradox[5061]: 2019-10-10 18:16:32,341 - ERROR    - PAI.paradox.paradox - Got ERROR Message: Invalid PC Password
Oct 10 18:16:33 raspberrypi pai-paradox[5061]: 2019-10-10 18:16:33,338 - ERROR    - PAI.paradox.paradox - Got ERROR Message: Invalid PC Password
Oct 10 18:16:34 raspberrypi pai-paradox[5061]: 2019-10-10 18:16:34,359 - ERROR    - PAI.paradox.paradox - Got ERROR Message: Invalid PC Password
Oct 10 18:16:35 raspberrypi pai-paradox[5061]: 2019-10-10 18:16:35,400 - ERROR    - PAI.paradox.paradox - Got ERROR Message: Invalid PC Password
Oct 10 18:16:36 raspberrypi pai-paradox[5061]: 2019-10-10 18:16:36,191 - ERROR    - PAI.paradox.hardware.spectra_magellan.panel - Initialization Failed
Oct 10 18:16:36 raspberrypi pai-paradox[5061]: 2019-10-10 18:16:36,192 - ERROR    - PAI.paradox.paradox - Failed to connect: Failed to initialize communication
Oct 10 18:16:36 raspberrypi pai-paradox[5061]: 2019-10-10 18:16:36,194 - ERROR    - PAI - Unable to connect to alarm
```
Again, a little bit after, I'm seeing a different error now:
```
Oct 10 18:25:25 raspberrypi pai-paradox[5061]: 2019-10-10 18:25:25,211 - ERROR    - PAI.paradox.connections.ip_connection - Connection to panel was lost
Oct 10 18:25:25 raspberrypi pai-paradox[5061]: 2019-10-10 18:25:25,212 - INFO     - PAI.paradox.connections.ip_connection - Closing IP Connection
Oct 10 18:25:25 raspberrypi pai-paradox[5061]: Exception in callback _SelectorTransport._add_reader(11, <bound method..., bufsize=0>>>)
Oct 10 18:25:25 raspberrypi pai-paradox[5061]: handle: <Handle _SelectorTransport._add_reader(11, <bound method..., bufsize=0>>>)>
Oct 10 18:25:25 raspberrypi pai-paradox[5061]: Traceback (most recent call last):
Oct 10 18:25:25 raspberrypi pai-paradox[5061]:   File "/usr/lib/python3.7/asyncio/selector_events.py", line 251, in _add_reader
Oct 10 18:25:25 raspberrypi pai-paradox[5061]:     key = self._selector.get_key(fd)
Oct 10 18:25:25 raspberrypi pai-paradox[5061]:   File "/usr/lib/python3.7/selectors.py", line 192, in get_key
Oct 10 18:25:25 raspberrypi pai-paradox[5061]:     raise KeyError("{!r} is not registered".format(fileobj)) from None
Oct 10 18:25:25 raspberrypi pai-paradox[5061]: KeyError: '11 is not registered'
Oct 10 18:25:25 raspberrypi pai-paradox[5061]: During handling of the above exception, another exception occurred:
Oct 10 18:25:25 raspberrypi pai-paradox[5061]: Traceback (most recent call last):
Oct 10 18:25:25 raspberrypi pai-paradox[5061]:   File "/usr/lib/python3.7/asyncio/events.py", line 88, in _run
Oct 10 18:25:25 raspberrypi pai-paradox[5061]:     self._context.run(self._callback, *self._args)
Oct 10 18:25:25 raspberrypi pai-paradox[5061]:   File "/usr/lib/python3.7/asyncio/selector_events.py", line 705, in _add_reader
Oct 10 18:25:25 raspberrypi pai-paradox[5061]:     self._loop._add_reader(fd, callback, *args)
Oct 10 18:25:25 raspberrypi pai-paradox[5061]:   File "/usr/lib/python3.7/asyncio/selector_events.py", line 254, in _add_reader
Oct 10 18:25:25 raspberrypi pai-paradox[5061]:     (handle, None))
Oct 10 18:25:25 raspberrypi pai-paradox[5061]:   File "/usr/lib/python3.7/selectors.py", line 359, in register
Oct 10 18:25:25 raspberrypi pai-paradox[5061]:     self._selector.register(key.fd, poller_events)
Oct 10 18:25:25 raspberrypi pai-paradox[5061]: OSError: [Errno 9] Bad file descriptor
Oct 10 18:25:25 raspberrypi pai-paradox[5061]: 2019-10-10 18:25:25,217 - INFO     - PAI.paradox.connections.ip_connection - Connected to Site: MyPanel
Oct 10 18:25:25 raspberrypi pai-paradox[5061]: 2019-10-10 18:25:25,218 - INFO     - PAI.paradox.connections.ip_connection - Authenticating with IP Module
Oct 10 18:25:25 raspberrypi pai-paradox[5061]: Fatal write error on socket transport
Oct 10 18:25:25 raspberrypi pai-paradox[5061]: protocol: <paradox.connections.ip_connection.IPConnectionProtocol object at 0x75183670>
Oct 10 18:25:25 raspberrypi pai-paradox[5061]: transport: <_SelectorSocketTransport fd=11 read=idle write=<idle, bufsize=0>>
Oct 10 18:25:25 raspberrypi pai-paradox[5061]: Traceback (most recent call last):
Oct 10 18:25:25 raspberrypi pai-paradox[5061]:   File "/usr/lib/python3.7/asyncio/selector_events.py", line 857, in write
Oct 10 18:25:25 raspberrypi pai-paradox[5061]:     n = self._sock.send(data)
Oct 10 18:25:25 raspberrypi pai-paradox[5061]: OSError: [Errno 9] Bad file descriptor
```
After a day, the service got killed and restarted. Since them I'm getting this now:
```
Oct 11 16:07:04 raspberrypi pai-paradox[5523]: 2019-10-11 16:07:04,070 - INFO     - PAI - Starting...
Oct 11 16:07:04 raspberrypi pai-paradox[5523]: 2019-10-11 16:07:04,078 - INFO     - PAI.paradox.paradox - Disconnecting from the Alarm Panel
Oct 11 16:07:04 raspberrypi pai-paradox[5523]: 2019-10-11 16:07:04,079 - INFO     - PAI.paradox.paradox - Clean Session
Oct 11 16:07:04 raspberrypi pai-paradox[5523]: 2019-10-11 16:07:04,080 - INFO     - PAI.paradox.paradox - Connecting to interface
Oct 11 16:07:04 raspberrypi pai-paradox[5523]: 2019-10-11 16:07:04,082 - INFO     - PAI.paradox.connections.ip_connection - Connecting to Site: MyPanel
Oct 11 16:07:04 raspberrypi pai-paradox[5523]: 2019-10-11 16:07:04,082 - INFO     - PAI.paradox.connections.ip_connection - Getting site info
Oct 11 16:07:04 raspberrypi pai-paradox[5523]: 2019-10-11 16:07:04,622 - ERROR    - PAI.paradox.connections.ip_connection - {'class': b'\x00\x00\x04', 'code': 0, 'reason': b'Bad Peer Address'}
Oct 11 16:07:04 raspberrypi pai-paradox[5523]: 2019-10-11 16:07:04,623 - INFO     - PAI.paradox.connections.ip_connection - Connecting to Site: MyPanel
Oct 11 16:07:04 raspberrypi pai-paradox[5523]: 2019-10-11 16:07:04,819 - ERROR    - PAI.paradox.connections.ip_connection - {'class': b'\x00\x00\x04', 'code': 0, 'reason': b'Bad Peer Address'}
Oct 11 16:07:04 raspberrypi pai-paradox[5523]: 2019-10-11 16:07:04,819 - INFO     - PAI.paradox.connections.ip_connection - Connecting to Site: MyPanel
Oct 11 16:07:05 raspberrypi pai-paradox[5523]: 2019-10-11 16:07:05,005 - ERROR    - PAI.paradox.connections.ip_connection - {'class': b'\x00\x00\x04', 'code': 0, 'reason': b'Bad Peer Address'}
Oct 11 16:07:05 raspberrypi pai-paradox[5523]: 2019-10-11 16:07:05,006 - ERROR    - PAI.paradox.paradox - Failed to connect to interface
Oct 11 16:07:05 raspberrypi pai-paradox[5523]: 2019-10-11 16:07:05,008 - ERROR    - PAI - Unable to connect to alarm
Oct 11 16:07:05 raspberrypi pai-paradox[5523]: 2019-10-11 16:07:05,232 - INFO     - PAI.paradox.interfaces.mqtt.core - MQTT Broker Connected
```

**Comment by yozik04** [comment]
So they totally blocked you?

**Comment by yozik04** [comment]
IP150 latest 4.x firmware allows local connection without a site id... I really recommend switching to that.

**Comment by papaiatis** [comment]
Yeah, cannot connect at all. 
What does "Bad Peer Address" mean? 
Config file looks untouched since it was working fine the last time.

**Comment by papaiatis** [comment]
How do I switch to that local connection stuff? I've never heard of it.

**Comment by yozik04** [comment]
Try to comment out all ‘IP_CONNECTION_*’ settings, except ‘IP_CONNECTION_HOST’ pointing to your IP150 local IP address.

**Comment by papaiatis** [comment]
Thanks @yozik04 ! That worked! Also did an update (git pull) so now I'm testing the system again.

**Comment by yozik04** [comment]
Great news! I will take a look at exceptions you posted anyway.

**Comment by papaiatis** [comment]
With the latest code I'm now seeing lots of warnings for this line: https://github.com/ParadoxAlarmInterface/pai/blob/dev/paradox/paradox.py#L543

I went through each commit and this is the one that introduced the warnings:
https://github.com/ParadoxAlarmInterface/pai/commit/f3d37e75eaf6d0588f5eebcaead5595c5e617a6a

**Comment by yozik04** [comment]
To fix those warnings @jpbarraca need to have a look. I fixed all for EVO.

**Comment by yozik04** [comment]
It is not critical it is recomendatory.

**Comment by jpbarraca** [comment]
I will check this.
